11:10:16.784392 arp who-has luke.icsr.agh.edu.pl tell sped.icsr.agh.edu.pl
11:10:19.818945 IP FARM1.1332 > 216.239.59.147.80: S 3215024326:3215024326(0) win 65535 <mss 1460,nop,nop,sackOK>
11:10:19.871697 IP FARM1.137 > 216.239.59.147.137: UDP, length: 50
11:10:19.878162 IP 216.239.59.147.80 > FARM1.1332: S 3351702732:3351702732(0) ack 3215024327 win 8190 <mss 1460>
11:10:19.878519 IP FARM1.1332 > 216.239.59.147.80: . ack 1 win 65535
11:10:19.879234 IP FARM1.1332 > 216.239.59.147.80: P 1:466(465) ack 1 win 65535
11:10:19.938570 IP 216.239.59.147.80 > FARM1.1332: . ack 466 win 7725
11:10:19.939355 IP 216.239.59.147.80 > FARM1.1332: . ack 466 win 6432
11:10:19.945064 IP 216.239.59.147.80 > FARM1.1332: P 1431:1636(205) ack 466 win 6432
11:10:19.945334 IP FARM1.1332 > 216.239.59.147.80: . ack 1 win 65535
11:10:19.945747 IP 216.239.59.147.80 > FARM1.1332: . 1:1431(1430) ack 466 win 6432
11:10:19.946068 IP FARM1.1332 > 216.239.59.147.80: . ack 1636 win 65535
11:10:20.267422 IP FARM1.1333 > 216.239.59.104.80: . ack 1 win 65535
11:10:20.268049 IP FARM1.1333 > 216.239.59.104.80: P 1:435(434) ack 1 win 65535
11:10:20.327218 IP 216.239.59.104.80 > FARM1.1333: . ack 435 win 7756
11:10:20.327830 IP 216.239.59.104.80 > FARM1.1333: . ack 435 win 6432
11:10:20.340294 IP 216.239.59.104.80 > FARM1.1333: P 1:175(174) ack 435 win 6432
11:10:20.542503 IP FARM1.1333 > 216.239.59.104.80: . ack 175 win 65361
11:10:21.370580 IP FARM1.137 > 216.239.59.147.137: UDP, length: 50
11:10:22.352130 IP squirel.icsr.agh.edu.pl.137 > 149.156.99.127.137: UDP, length: 50
11:10:22.870530 IP FARM1.137 > 216.239.59.147.137: UDP, length: 50
11:10:24.866723 IP net.icsr.agh.edu.pl.137 > 149.156.99.127.137: UDP, length: 50
11:10:25.295580 IP FARM1.1184 > student.uci.agh.edu.pl.22: P 2283908409:2283908477(68) ack 1006596062 win 64543
11:10:25.387503 IP FARM1.137 > 216.239.59.104.137: UDP, length: 50
11:10:25.388091 IP student.uci.agh.edu.pl.22 > FARM1.1184: . ack 68 win 24820
11:10:25.388352 IP FARM1.1184 > student.uci.agh.edu.pl.22: P 68:88(20) ack 1 win 64543
11:10:25.408187 IP student.uci.agh.edu.pl.22 > FARM1.1184: P 1:45(44) ack 88 win 24820
11:10:25.409031 IP FARM1.1184 > student.uci.agh.edu.pl.22: P 88:156(68) ack 45 win 64499
11:10:25.507990 IP student.uci.agh.edu.pl.22 > FARM1.1184: . ack 156 win 24820
11:10:25.508255 IP FARM1.1184 > student.uci.agh.edu.pl.22: P 156:176(20) ack 45 win 64499
11:10:25.538113 IP student.uci.agh.edu.pl.22 > FARM1.1184: P 45:121(76) ack 176 win 24820
11:10:25.539054 IP FARM1.1184 > student.uci.agh.edu.pl.22: P 176:244(68) ack 121 win 64423
11:10:25.615840 IP net.icsr.agh.edu.pl.137 > 149.156.99.127.137: UDP, length: 50
11:10:25.638029 IP student.uci.agh.edu.pl.22 > FARM1.1184: . ack 244 win 24820
11:10:25.638293 IP FARM1.1184 > student.uci.agh.edu.pl.22: P 244:264(20) ack 121 win 64423
11:10:25.651324 IP student.uci.agh.edu.pl.22 > FARM1.1184: P 121:805(684) ack 264 win 24820
11:10:25.792345 IP FARM1.1184 > student.uci.agh.edu.pl.22: . ack 805 win 65535
11:10:25.796810 IP student.uci.agh.edu.pl.22 > FARM1.1184: P 805:849(44) ack 264 win 24820
11:10:26.011094 IP FARM1.1184 > student.uci.agh.edu.pl.22: . ack 849 win 65491
11:10:26.365814 IP net.icsr.agh.edu.pl.137 > 149.156.99.127.137: UDP, length: 50
11:10:26.886040 IP FARM1.137 > 216.239.59.104.137: UDP, length: 50
11:10:28.385991 IP FARM1.137 > 216.239.59.104.137: UDP, length: 50
11:10:28.983334 IP FARM1.1173 > luke.icsr.agh.edu.pl.22: P 4242530414:4242530546(132) ack 757976430 win 65471
11:10:29.056638 IP luke.icsr.agh.edu.pl.22 > FARM1.1173: . ack 132 win 32768
11:10:29.056914 IP FARM1.1173 > luke.icsr.agh.edu.pl.22: P 132:152(20) ack 1 win 65471
11:10:29.062391 IP luke.icsr.agh.edu.pl.22 > FARM1.1173: P 1:45(44) ack 152 win 32768
11:10:29.062927 IP FARM1.1173 > luke.icsr.agh.edu.pl.22: P 152:172(20) ack 45 win 65427
11:10:29.092220 IP luke.icsr.agh.edu.pl.22 > FARM1.1173: P 45:89(44) ack 172 win 32768
11:10:29.092800 IP FARM1.1173 > luke.icsr.agh.edu.pl.22: P 172:192(20) ack 89 win 65383
11:10:29.102121 IP luke.icsr.agh.edu.pl.22 > FARM1.1173: P 89:125(36) ack 192 win 32768
11:10:29.106043 IP FARM1.1173 > luke.icsr.agh.edu.pl.22: P 192:212(20) ack 125 win 65347
11:10:29.116797 IP luke.icsr.agh.edu.pl.22 > FARM1.1173: P 125:1585(1460) ack 212 win 32768
11:10:29.117074 IP luke.icsr.agh.edu.pl.22 > FARM1.1173: P 1585:1921(336) ack 212 win 32768
11:10:29.117285 IP FARM1.1173 > luke.icsr.agh.edu.pl.22: . ack 1921 win 65535
11:10:29.122117 IP luke.icsr.agh.edu.pl.22 > FARM1.1173: P 1921:1941(20) ack 212 win 32768
11:10:29.122621 IP FARM1.1173 > luke.icsr.agh.edu.pl.22: P 212:232(20) ack 1941 win 65515
11:10:29.152184 IP luke.icsr.agh.edu.pl.22 > FARM1.1173: P 1941:1985(44) ack 232 win 32768
11:10:29.292234 IP FARM1.1173 > luke.icsr.agh.edu.pl.22: . ack 1985 win 65471
11:10:29.887262 IP FARM1.1041 > luke.icsr.agh.edu.pl.53:  14177+ PTR? 127.99.156.149.in-addr.arpa. (45)
11:10:29.887819 IP luke.icsr.agh.edu.pl.53 > FARM1.1041:  14177 NXDomain* 0/1/0 (135)
11:10:35.061616 IP FARM1.1328 > ernie.icslab.agh.edu.pl.22: P 3745052122:3745052522(400) ack 881349236 win 65210
11:10:35.062662 IP ernie.icslab.agh.edu.pl.22 > FARM1.1328: F 1:1(0) ack 400 win 24820
11:10:35.063168 IP FARM1.1328 > ernie.icslab.agh.edu.pl.22: . ack 2 win 65210
11:10:35.063849 IP FARM1.1328 > ernie.icslab.agh.edu.pl.22: F 400:400(0) ack 2 win 65210
11:10:35.064376 IP ernie.icslab.agh.edu.pl.22 > FARM1.1328: . ack 401 win 24820
11:10:48.133405 IP FARM1.1334 > luke.icsr.agh.edu.pl.22: S 605740831:605740831(0) win 65535 <mss 1460,nop,nop,sackOK>
11:10:48.133643 IP luke.icsr.agh.edu.pl.22 > FARM1.1334: S 1596621236:1596621236(0) ack 605740832 win 32768 <mss 1460>
11:10:48.133958 IP FARM1.1334 > luke.icsr.agh.edu.pl.22: . ack 1 win 65535
11:10:48.137980 IP luke.icsr.agh.edu.pl.22 > FARM1.1334: P 1:24(23) ack 1 win 32768
11:10:48.155291 IP FARM1.1334 > luke.icsr.agh.edu.pl.22: P 1:28(27) ack 24 win 65512
11:10:48.156761 IP luke.icsr.agh.edu.pl.22 > FARM1.1334: P 24:300(276) ack 28 win 32768
11:10:48.172684 IP FARM1.1334 > luke.icsr.agh.edu.pl.22: P 28:184(156) ack 300 win 65236
11:10:48.236474 IP luke.icsr.agh.edu.pl.22 > FARM1.1334: . ack 184 win 32768
11:10:48.321969 IP luke.icsr.agh.edu.pl.22 > FARM1.1334: P 300:312(12) ack 184 win 32768
11:10:48.432329 IP FARM1.1334 > luke.icsr.agh.edu.pl.22: . ack 312 win 65224
11:10:52.790004 IP FARM1.1335 > arax.uci.agh.edu.pl.80: S 3711582108:3711582108(0) win 65535 <mss 1460,nop,nop,sackOK>
11:10:52.790715 IP arax.uci.agh.edu.pl.80 > FARM1.1335: S 2071915938:2071915938(0) ack 3711582109 win 24820 <nop,nop,sackOK,mss 1460>
11:10:52.791043 IP FARM1.1335 > arax.uci.agh.edu.pl.80: . ack 1 win 65535
11:10:52.792878 IP FARM1.1335 > arax.uci.agh.edu.pl.80: P 1:467(466) ack 1 win 65535
11:10:52.793677 IP arax.uci.agh.edu.pl.80 > FARM1.1335: . ack 467 win 24820
11:10:52.796343 IP arax.uci.agh.edu.pl.80 > FARM1.1335: P 1:223(222) ack 467 win 24820
11:10:52.819010 IP FARM1.1335 > arax.uci.agh.edu.pl.80: P 467:821(354) ack 223 win 65313
11:10:52.820567 IP arax.uci.agh.edu.pl.80 > FARM1.1335: P 223:447(224) ack 821 win 24820
11:10:52.832932 IP FARM1.1335 > arax.uci.agh.edu.pl.80: P 821:1175(354) ack 447 win 65089
11:10:52.834366 IP arax.uci.agh.edu.pl.80 > FARM1.1335: P 447:671(224) ack 1175 win 24820
11:10:52.844017 IP FARM1.1335 > arax.uci.agh.edu.pl.80: P 1175:1528(353) ack 671 win 64865
11:10:52.848142 IP arax.uci.agh.edu.pl.80 > FARM1.1335: P 671:894(223) ack 1528 win 24820
11:10:52.866814 IP FARM1.1335 > arax.uci.agh.edu.pl.80: P 1528:1878(350) ack 894 win 64642
11:10:52.868413 IP arax.uci.agh.edu.pl.80 > FARM1.1335: P 894:1117(223) ack 1878 win 24820
11:10:52.881796 IP FARM1.1335 > arax.uci.agh.edu.pl.80: P 1878:2229(351) ack 1117 win 64419
11:10:52.883710 IP arax.uci.agh.edu.pl.80 > FARM1.1335: P 1117:1340(223) ack 2229 win 24820
11:10:52.919522 IP FARM1.1333 > 216.239.59.104.80: P 435:872(437) ack 175 win 65361
11:10:52.982391 IP 216.239.59.104.80 > FARM1.1333: . ack 872 win 7753
11:10:52.982603 IP 216.239.59.104.80 > FARM1.1333: . ack 872 win 6432
11:10:52.992998 IP 216.239.59.104.80 > FARM1.1333: P 175:349(174) ack 872 win 6432
11:10:53.025950 IP FARM1.1335 > arax.uci.agh.edu.pl.80: . ack 1340 win 64196
11:10:53.135319 IP FARM1.1333 > 216.239.59.104.80: . ack 349 win 65187
11:10:56.358042 IP squirel.icsr.agh.edu.pl.138 > 149.156.99.127.138: UDP, length: 237
11:10:56.359596 IP luke.icsr.agh.edu.pl.138 > 149.156.99.127.138: UDP, length: 213
11:10:56.360013 IP luke.icsr.agh.edu.pl.138 > 149.156.99.127.138: UDP, length: 205
11:11:00.023595 IP FARM1 > galaxy.uci.agh.edu.pl: icmp 40: echo request seq 11520
11:11:00.024256 IP galaxy.uci.agh.edu.pl > FARM1: icmp 40: echo reply seq 11520
11:11:01.010127 IP FARM1 > galaxy.uci.agh.edu.pl: icmp 40: echo request seq 11776
11:11:01.010681 IP galaxy.uci.agh.edu.pl > FARM1: icmp 40: echo reply seq 11776
11:11:02.010105 IP FARM1 > galaxy.uci.agh.edu.pl: icmp 40: echo request seq 12032
11:11:02.010676 IP galaxy.uci.agh.edu.pl > FARM1: icmp 40: echo reply seq 12032
11:11:03.010120 IP FARM1 > galaxy.uci.agh.edu.pl: icmp 40: echo request seq 12288
11:11:03.010815 IP galaxy.uci.agh.edu.pl > FARM1: icmp 40: echo reply seq 12288
11:11:09.203383 IP arax.uci.agh.edu.pl.80 > FARM1.1335: F 1340:1340(0) ack 2229 win 24820
11:11:09.203851 IP FARM1.1335 > arax.uci.agh.edu.pl.80: . ack 1341 win 64196
11:11:09.919230 IP FARM1.1041 > luke.icsr.agh.edu.pl.53:  52322+ A? www.onet.pl. (29)
11:11:09.919896 IP luke.icsr.agh.edu.pl.53 > FARM1.1041:  52322 1/4/4 A f1virt.onet.pl (206)
11:11:09.927425 IP FARM1 > f1virt.onet.pl: icmp 40: echo request seq 12544
11:11:09.929286 IP f1virt.onet.pl > FARM1: icmp 40: echo reply seq 12544
11:11:10.885638 IP FARM1.1041 > luke.icsr.agh.edu.pl.53:  57699+ PTR? 200.130.180.213.in-addr.arpa. (46)
11:11:10.916117 IP FARM1 > f1virt.onet.pl: icmp 40: echo request seq 12800
11:11:10.919211 IP f1virt.onet.pl > FARM1: icmp 40: echo reply seq 12800
11:11:10.946317 IP luke.icsr.agh.edu.pl.53 > FARM1.1041:  57699* 1/3/3 (190)
11:11:11.916091 IP FARM1 > f1virt.onet.pl: icmp 40: echo request seq 13056
11:11:11.919859 IP f1virt.onet.pl > FARM1: icmp 40: echo reply seq 13056
11:11:12.869403 IP FARM1.1335 > arax.uci.agh.edu.pl.80: R 2229:2229(0) ack 1341 win 0
11:11:12.916044 IP FARM1 > f1virt.onet.pl: icmp 40: echo request seq 13312
11:11:12.918685 IP f1virt.onet.pl > FARM1: icmp 40: echo reply seq 13312
11:11:13.964962 IP boxer.icsr.agh.edu.pl.137 > 149.156.99.127.137: UDP, length: 50
11:11:14.711650 IP boxer.icsr.agh.edu.pl.137 > 149.156.99.127.137: UDP, length: 50
11:11:15.462614 IP boxer.icsr.agh.edu.pl.137 > 149.156.99.127.137: UDP, length: 50

